numerical_review,comments,sentiment,review_length,label
2,The street is quite and apartment was at first floor,0.25,52,1
2,"The space is very cozy, the room is wide and comfortable. It has everything that is needed and more than expected.",0.08800000000000001,114,1
2,A pleasant stay,0.7333333333333334,15,1
1,"House did not match the expectation, pictures are very old, the apartment is now falling apart. The electrical system need to be reworked because it isn't enough powerful and the fridge keep switching off, we had to go to the office to get a technician to fix the problem (he didn't). when we arrived the apartment wasn't properly cleaned and there was food from the prior guests. the terrace needs power washing.",0.086,413,1
5,"Our stay at Bernhard’s place was lovely - we really liked the creative interior design and the perfect location to wander around the city center. Bernhard is the PERFECT host you can imagine - always helpful, makes you feel at home and shares his passion for music and literature as a bonus :) Thank you so much for having us, we loved it and we will be coming back!",0.49000000000000005,366,0
5,My friends and I made our trip to Barcelona very easy and comfortable by choosing this apartment! Thank you very much : ),0.45583333333333337,121,0
5,"Stayed for 3 months and loved it. The apartment came with everything you need. Great location, very central",0.5,109,0
4,Wonderful location and very stylish apartment.,0.825,46,0
2,perfectly held establishment. Very welcome. Perfect value for money. 2 minutes from the Rambla. I highly recommend.,0.79,115,1
4,"Great location, right in the middle of town.",0.36190476190476195,44,0
3,"The concierge staff were lovely & really helpful. I was slightly disappointed by my room which had no external walls/windows & backed onto the central atrium of the building. There was lots of noise from the surrounding corridors, the glass lift was opposite the bedroom window & the blinds in the room were really flimsy gauze so the light from the hallways & lift made the room bright all night & I didn't sleep well. They were flexible on check-in time & helpfully had a luggage room to store bags once checked out. I think the hotel is slightly overpriced but it's difficult to find anything much cheaper in central Barcelona!",0.06025641025641025,630,0
4,"For a last minute nocarz booking, the place did its job, albeit lacked basic amenities such as hand soap, cabinet/drawer for toiletries/hygiene. The shower was quite musty and the shower doors were very rusty and did not open and close easily, in fact a nail came off during a shower. The sleeping area has a huge water heater hanging above the bed, quite an awkward placement for such a thing IMO. In the corner of the room had an old bed propped upright with a wooden board leaning against it. Wasn’t sure why that was there, certainly didn’t add to the space. At night noise levels is quite loud. You can literally hear everything outside on the street traffic, such as the engines of buses, trucks and nearby pedestrians. The windows did nothing in terms of sound proofing. Lastly I noticed a small puddle in the room that looks like it leaked from the other room next to mine. Overall wasn’t a pleasant experience, but it got me through the trip.",0.09572510822510823,979,0
1,"To start the address indicated is not the location of the entrance to the apartment which is done in a perpendicular street, by a much less elegant door, and with a note indicating that the tourist rentals are prohibited in the building. Then the room is certainly large but not very clean, especially the shower whose condition was frankly to be desired. Fortunately, the toilets were ok. Too bad the trash was not emptied after the departure of the previous occupants. The mattress was far too small for the box spring and there was an old mattress and a wooden board negligently placed against one of the walls of the bedroom. The so-called common room was without natural light and really ugly and not very pleasant. The whole apartment, huge and which must have been superb in its time, is cluttered with all kinds of fairly ugly objects taking all the space: car paintings, Asian trinkets, etc. In conclusion: a room far too expensive",0.004315018315018322,965,1
5,It was awesome. Very tiny but super clean apartment in the heart of Barceloneta! Communication with Joaquim was super easy and in general very good. I can highly recommend it :),0.4178333333333334,177,0
4,"We have had a lovely time in Barcelona. Eucari was a really great host, she was so cute and friendly and tried to help us exploring the city. Her English is not that good, but we managed to figure out what she was trying to say all the time. The location of the appartment is really nice for a citytrip. A lot of highlights are in walking distance and also public transport is nearby to get you everywhere you wanna go. Unfortunately we have some negative things about the appartment itself: - the host and her friends are smoking inside the kitchen, which we did not like. Also, the kitchen has got a really gross smell. - the bedroom does not have an airco so it was really hot sleeping there. - the bathroom is ok, but small. When you turn around in the shower, you are always hitting the button thay regulates that strength and the temperature of the shower. The advertisement on the nocarz website says you have 1.5 bathroom, which is not the case. - apparently she rents another room in the same house, a thing we did not know about when going to this appartment. Halfway our vacation she texted us with the question if we could pick up our shampoo and towels etc because of the other guests that were renting the other room. We had to share the bathroom with them, which is something we could not make up from the advertisement. So 1.5 bathroom for yourself really is not the case, actually you have to share the small bathroom with other guests. - all rooms cannot be locked, both the bedrooms and the bathroom. We were okay with that, but when we found out about the other guests we had to share the bathroom with, we didn't feel comfortable about this. Also the bedrooms cannot be locked, which we find is really weird since the other guests can theoretically just walk in and steal stuff when you are not at the appartment. When we asked Eucari about it, she told is that having locks for rooms is very uncommon in Spain. Nevertheless, Eucari's room is the only room that has a lock on it so we thought the whole lock-story was really weird when more guests are staying at the same appartment. So in conclusion, we really liked Eucari and the location of the appartment. The appartment has got everything you need for a citytrip, but we have some negative experiences about it.",0.13285714285714287,2322,0
2,Good communication,0.7,18,1
5,"Amazing Place, I was with my parents and they felt like home. Comfy and very good location. Recommend!",0.8,102,0
4,"Great location! We loved the comfy bed and pillows and the unit was just as described and quaint. Excellent water pressure, but runs out of hot water fairly soon if there are 2 back to back showers being taken. Also, quite noisy all night long, but we use a very loud white noise app. We would stay there again.",0.37300000000000005,316,0
5,"Loved this accommodation, perfect hosts always responsive ready and attentive!",0.6,78,0
5,"Very nice place in a quiet suburb of the city. Michael’s communication is simply breathtaking, from the instructions to finding the place, to informative tips on what to do and how to use all the various utilities. The apartment has a somewhat unorthodox feel due to being on the street but, you soon get used to this and it is a very quiet neighbourhood. The pizza restaurant around the corner is sensational. Nobody goes to Barcelona for pizza but I assure you, it’s worth it. The metro is 5 minutes and we had no issues with security etc. the price I think is reflective of Barcelona in general, accommodation costs are steep and this isn’t out of the ordinary. Would recommend.",0.24216666666666664,681,0
4,"The place is excellent because it offers several possibilities, given that it is close to the Metro Diagonal stop, in addition it is 2 minutes walk from the Pedrera. In addition to the excellent position, the welcome was excellent, the host was very cute and super kind, the common environments were clean, as was the room. Everything corresponded to the description and we were pleasantly affected. We will definitely return!",0.4833333333333334,426,0
5,"Birdhouse was a nice Guesthouse. Clean and cozy rooms. The guesthouse is in the near of a lot good restaurants, bars and more. If you want to stay there do not forget earplugs, the walls are thin and you hear every noise from the neighbors.",0.23809523809523808,241,0
5,"We had a great stay at Daniel’s apartment. It was perfect for us and our two young children (5 and 8). The apartment has some wear and tear, but for us, this was fine because we were comfortable with children. And the price was very reasonable for the location. Gracia is our favorite neighborhood and this apartment is in a great spot. One nice thing this apartment has is a very large dryer, which is rare in Spain. Also, Daniel is very friendly and equips the apartment with everything you need for a comfortable stay. We would definitely stay with Daniel again.",0.45618253968253963,565,0
3,We spent the weekend in Barcelona to celebrate a wedding. The house was perfect as a location to prepare and strategic to get to put and move around the city. Very satisfied.,0.5166666666666667,186,0
2,Very good location and a very nice host. highly recommended,0.6166666666666666,59,1
5,Place is definitely great to stay and very close to the beach. Clean and neat as described. Communication and availability to respond was also on point. Price is slightly on the higher side otherwise everything is perfect about the place and nothing to complain.,0.4083333333333334,262,0
4,Nice boutique hotel located in Placa Reial. Closer to everything.,0.6,65,0
5,"The location is ideal, the furniture and the conditions for the short -term rent. The disadvantage is the only door that divides the apartment from the adjacent apartment and or one noise on the other or vice versa. There is no way to live in complete silence. Everything else is wonderful",0.2873376623376624,293,0
2,"We stayed 4 days in Barcelona and the house was very welcoming! We were also very good, the children were happy with the accommodation for the spacious and bright living room",0.665,174,1
2,"Central location, good cleaning, communication with punctual and precise uma. not very positive sides are: the tub is difficult to access and the shower does not spread the water in a uniform but directional way, if you return long walks the shower will not be a nice moment to relax, however functional to wash. The water also not always hot but warm (however acceptable). The elevator had broken during his stay. The last day was also not present toilet paper and we had to use handkerchiefs. Overall a little expensive compared to the services offered.",0.04948462995337995,567,1
5,Awesome location and clean. We loved our stay!,0.7472222222222222,46,0
5,"Looks like pictures, nice place to stay! Wish checkin was a less extensive and invasive process, though. And it would have been nice to have a little more storage, since it’s such a small room — places to put away suitcases and hang long dresses would have been very welcome.",0.21958333333333332,275,0
2,Located in a very good very clean place and the welcome was very warm. I recommend it,0.7416666666666667,91,1
2,Hostel with a limited number of rooms. This always makes it welcoming and clean. Highly recommended,0.15174603174603177,99,1
3,The apartment is nice and located close to the metro. It’s a quiet area but all amenities are within a few minutes walk.,0.13333333333333333,120,0
2,"Very correct accommodation for the price, clean and well supplied. Small interior courtyard very pleasant for breakfast or to end the day tranqually. Functional room with storage, very effective ceiling fan, we were not hot despite the absence of air conditioning. Only small remark: the windows overlook the interior of the building so no natural light.",0.18295454545454543,354,1
4,Ella is very responsive and communicate check in details well. Would recommend,0.2,78,0
5,good location and an easy way of checking in and friendly receptionist.,0.5027777777777778,71,0
2,It's very nice,0.78,14,1
5,"Cozy and pretty hostel, the room looks like the pictures. Enough bathrooms that you didn’t have to wait for your turn. Terrasse was really pretty and had a nice vibe for morning coffee and reading. The walls and doors are although quite thin, so you could hear your people in other rooms pretty clearly.",0.08055555555555555,303,0
4,lovely place,0.5,12,0
4,Great,0.8,5,0
0,"The small but fine apartment is located just outside the center of Barcelona. However, everything is very convenient to reach with the metro or the bus. Communication to the host was always perfect.",0.2111111111111111,198,1
2,Host to recommend. No worries. Perfect,1.0,38,1
4,"I totally recommend Alexander’s place! It is a very nice flat, well equipped, clean and cozy. It’s not very close to the city center but close to metro station.",0.1030952380952381,160,0
5,"Booked this place as a retirement gift for my parents. Great location, ideal for sightseeing! Exactly what i needed.",0.8500000000000001,120,0
5,Marc was super responsive and was extremely flexible with an earlier check in. Any time we had to message Marc he responded super quickly. Thanks Marc,0.14833333333333334,150,0
2,"Great attention and immediate response, our little initial inconveniences were treated with promptness and kindness. The very pleasant and excellently located apartment to learn about the most important points of interest in the city",0.4951190476190476,233,1
5,Lovely decor and super friendly service! Location was perfect; it was 15 min walk to most restaurants and 4 minutes away from the nearest metro station. Highly recommend to anyone visiting Barcelona.,0.4936805555555555,199,0
4,"We were delighted with the room, and very young and retired was super clean and smelling. Remember that the building has elevator which makes it much easier. And the main, the location is great being close to all famous sights",0.39958333333333335,226,0
5,Lovely apartment in a great part of Gracia. Easy access. Fully stocked with cooking equipment in the kitchen!,0.6138888888888889,109,0
3,"Nice and clean apartment, quite nice neighborhood although rather popular. We regretted and did not understand that we were passionate about an agency, so a chek in to do before arriving with a lot of data to enter what we do not usually do, and less flexibility. We lost an hour when we arrived, the apartment being available until 3 p.m. We had our luggage in the car that we had to park so risk of theft, which is quite common in Barcelona. And difficulty in entering the apartment: we had to push the door quite strong ... We had to call the agency, which was reactive. In short, a little stress. But good stay.",0.24006410256410257,615,0
4,"New apartment, totally renovated. Ideal and very well connected to Metro. Thank you so much!",0.29727272727272724,92,0
2,"Patricia was a super -friendly host, very helpful, interested and speaks English (and French). Ordering taxis online was very difficult these days, Patricia called us. It is a small room with n balcony, kitchen could be used, fruit and tea for breakfast. Nocarz as it was originally intended!",0.08078703703703702,304,1
2,Calm and well connected space with the attractions of the city.,0.30000000000000004,63,1
4,Excellent stay! Very welcome and attentive staff. Very pretty room with a good breakfast.,0.6849999999999999,89,0
4,Thank you for any excellent stay in a very nice apartment,0.89,57,0
4,"All perfect, super recommended!",0.7083333333333333,31,0
2,Very good,0.9099999999999999,9,1
2,Very good stay! Very comfortable apartment with everything you need for a stay,0.76,78,1
4,A lovely clean apartment and very conveniently located,0.35555555555555557,54,0
5,"Check in was seamless and easy. The staff are very friendly and the apartment is amazing. Great location, super modern and homely. Had a great stay Jesus & the Aspasios were absolutely brilliant. Super helpful when needed with a slight issue accessing our apartment one night. Managed to get someone out to help me very quickly.",0.4378472222222223,332,0
2,"Very well located. Super pretty decoration, very pleasant to be inside. Spacious and bright. We receive the department in optimal conditions. The part of the pool is also very pretty. It is like an oasis of nature in the center. The check in, opening of doors, is very technological. It can be half difficult at the beginning, then you get used to. Thank you very much Jesus! We have had incredible!",0.2933333333333334,423,1
5,"Jesus’s place serves our family of four well. We have 2 boys ages 3 and 6 and they had enough room to play and spread apart. The only thing that would have been a bonus is a small step stool but again that’s just because we had two small children. The pool was great, laundry with washer and dryer and air conditioning was crucial in the 90 degree heat.",0.05000000000000001,353,0
2,Very central but perfectly soundproofed.,0.5,40,1
4,"Great, very welcoming, exceptional dining",0.5555555555555555,41,0
5,"Perfect stay, the front desk staff was super nice and welcoming. Close to the train station which made it really easy for me to get around. Couldn’t of asked for a better accommodation for my first time in Barcelona!",0.529861111111111,216,0
2,"Central hotel, very close to the metro. Well illuminated neighborhood. Kind staff",0.26666666666666666,81,1
4,Had a great stay at Chic and Basic,0.4,34,0
2,Good hotel overall he was well located and the staff were reactive. Regarding the rooms it was poorly isolated and a lot of degradation at the bathroom,0.09999999999999998,151,1
5,"My wife and I had a wonderful stay for 9 nights in the lovely suite. The location is perfect and a short walk to several metro spots where Barcelona and the surrounding area are easily accessible. Staff were incredibly responsive, friendly and knowledgable with many suggestions as well as tips. I would highly reccommend for other travellers and would happily stay there again.",0.45708333333333334,378,0
5,"The location of this apartment was great and the apartment itself super comfortable. Communication with the hosts was excellent. Bedrooms face quiet side, which is great. Definitely recommend this place for a visit to Barcelona!",0.37777777777777777,240,0
5,"Excellent stay! If you travel to Barcelona I highly recommend staying here. Excellent location near Ramblas, beautiful and clean apartment. The host Edward excellent and very nice , always responsive and gave a lot of recommendations of great restaurants. I will definitely stay here again :)",0.5960606060606061,292,0
4,"Pros: very well located, spacious, baby friendly, lift, two bedrooms with lots of storage, responsive hosts, spacious, baby friendly, daily cleaning included, very good shower pressure and temperature, comfy beds and no noise at all. Cons: small (and a bit old) bathroom, small towels, bedrooms quite difficult to heat, front door left open one day after cleaning, no oven glove.",0.08727272727272727,383,0
4,Great spot for a trip to Barcelona. It was in a good location to walk/get around,0.75,80,0
5,We had a lovely stay. Having the metro at the doorstep was really helpful for whenever we didn’t fancy walking and the surrounding restaurants and bars were super friendly and good value for money.,0.4216666666666667,197,0
2,"The place is very nice and everything is announced in advertising, it is very well located.",0.49,91,1
2,Luis is an excellent host. He was always attentive to doubts and was clear in everything. The accommodation is perfectly located and is very comfortable to work from there. I recommend it!,0.63,188,1
4,A pleasant place to stay near to central,0.2777777777777778,40,0
2,Parfait,0.0,7,1
5,"We had a great stay at Casa Cosi. The apartment looked better than the pictures, everything was spottless, and the host was super fast and responsive. Wonderful neighborhood, everything was within walking distance. Also, super restaurants near by! We would stay here again!",0.47470238095238093,273,0
5,"Great place, amazing balcony with view to segrada familia, very comfortable location. Would recomend!",0.6833333333333335,101,0
5,"The place is at a great location, perfect for our stay as a couple. Yanina was very kind and accommodating. 5 stars!",0.9250000000000002,116,0
2,"Modern and well decorated apartment, ideally located 2 steps from the Sagrada. Warm and pleasant welcome. a lot of noise because the apartment is located on an animated artery. very well equipped apartment. On the other hand, cleaning can be improved and the apartment better maintained.",0.4760416666666667,305,1
3,"Excellent experience. a clean, orderly, spacious and well equipped apartment. Very friendly and helpful receptionist that provided excellent advice for both movements and restaurants. We will gladly return.",0.6708333333333334,224,0
2,"The room was very clean as shown in the photo and was comfortable to use. After getting on the elevator, you have to go up and down a little on the stairs, but other than that, it's a very nice facility. The staff was also very friendly.",0.2394444444444445,242,1
2,"The location is a 5 -minute walk from Sagrada Familia, but it takes more than 40 minutes of walking away from the remaining major tourist destinations. The accommodation was clean and satisfactory overall. All guests may have difficulty entering the accommodation in a new environment.",0.21310606060606058,297,1
4,"Very nice apartment, tastefully decorated, Edwin is super nice and very helpful. We felt very comfortable. The location is great to the beach, there are many bars and restaurants in front of the door.",0.5333333333333333,206,0
5,"We stayed in Gilles' apartment with a family of 4. The three separate bedrooms were ideal for our family. The apartment is modern and very clean and one of the best apartments we stayed in in this area. The location is perfect, right on the Rambla del Poblenou. Bedlinnen and towels are provided and of good quality. Gilles is a very nice host, he is very clear and fast in communication and hospitable. We would definitely come back to this apartment, and recommend it to everyone. The apartment, host and location are all worth 5 stars!",0.46518315018315026,539,0
5,My husband and I stayed for 3 nights at Gilles’ place and it was perfect . The apartment is exactly as described with all the necessary amenities. The location is very central and on a pedestrian street which was great. Gilles was very helpful and communicated proactively. Highly recommend !!!! Thank you!,0.3911830357142857,306,0
5,The house is beautiful and Gilles was very responsive and accommodating with anything we needed. The home is very well stocked with everything you need. We really enjoyed our stay in his home!,0.46875,192,0
0,"The apartment is very nice and well maintained. It is nicely located in the Poblenou district and has opened up all the ways to use the diverse offers in the district. 500 meters to the sea, on a beautiful bathing beach.",0.5825,220,1
5,"Amazing apartment, our family had a great time staying here. Everything was perfect. Also location is one of the best in town. 5-15 minutes walk to all sightseeing. Also if you like shopping, one block away is a Luxury boutiques. And I want to suggest everyone who will stay here to have a breakfast in Zenith cafe, never tried such tasty food in Europe. Thank you again, definitely our next stay in Barcelona will be in your apartment.",0.48571428571428577,436,0
2,"Very clean apartment! Nothing extra, no clutter! Everything is in the photo! At first, we were a little puzzled, because it was a bedroom and at first glance it seemed dangerous ... But after communicating with the police, we were told that it was a completely quiet area and we have nothing to worry, and then there was no problem in the residence process, although we often returned late at night! The owners are very polite and quickly answer, only the best impressions of communicating with them !!!!",0.12222222222222223,516,1
2,Complies with the description Very well located near the metro Quiet Very good stay,0.3025,101,1
4,"The apartment had almost all the amenities one would need and was close to the main tourist street of Las Ramblas. The description described in the nocarz write-up is accurate and should be read closely. The neighborhood is undergoing gentrification and, while a bit gritty, was not an issue for us. I agree with the description written by Judy in February 2023. This is a place for people who are accustomed to traveling and want a good but not luxurious/expensive place to stay.",0.31666666666666665,480,0
5,The place was so cute and really amazing. The apartment was clean and comfortable and was all set up for us.,0.4666666666666667,108,0
5,"We had a great stay! The nocarz was as described, neat and had everything you need. The location is excellent, close to the metro and in the city centre. Would recommend for anyone who wants to explore Barcelona.",0.6666666666666666,221,0
