numerical_review,comments,sentiment,review_length,label
5,The apartment was AMAZING! One tip: Do not attempt to take a taxi going here because it is LITERALLY soooo close to Plaça Catalunya via Portal Del Angel. I also suggest taking this route for easier navigation with heavy luggage. The apartment is pristinely maintained. It has almost all the equipment and materials you'd need and you don't need to worry about lugging bags up a staircase because there's an elevator! (Thank God for the elevator). The apartment is spacious for three people and it could easily fit four to even five or six. The only thing is that there is almost no english channel (at the end we were able to find one with documentaries) and the hot water in the main bathroom sometimes gets faulty.,0.22708333333333336,720,0
4,"Apartment very well located! We had a great stay at 5 in Ramon's apartment. 2 steps from the Rambla, 20min walk from the beach. The whole family appreciated this stay in Barcelona. Thanks to Ramon for his apartment and his ease of communication.",0.32999999999999996,245,0
4,Great apartment but to park excessive parking,0.275,45,0
5,A fantastic location in the heart of the Gothic area!,0.5,53,0
5,Great location and the hosts are very helpful and responsive. The front rooms had a lot of street noise all the tine though because of the tourists and narrow streets. The furniture is very basic and not comfortable. The linens and amenities are very bare bones. Overall we were comfortable but it was a good value for the location more than the apartment.itself.,0.22649999999999998,363,0
2,A beautiful apartment very well equipped and very well placed. Lots of shops nearby. Very close metro. 15 'walk from the Sagrada Familia. Quite calm. I highly recommend it for family groups up to 6 people.,0.3183333333333333,207,1
4,Good house,0.7,10,0
4,"Blanca has been an excellent host. Communication has always been easy, and both arrival and departure simplified us. The house is phenomenally located, and very well conditioned. I hope we can repeat in summer",0.5333333333333333,209,0
5,"Great apartment with everything you could possibly need available for you. Great location, very central to everywhere we wanted to visit and found it very easy to find our way around the area. Hosts very helpful and responsive if ever there was a slight issue.",0.3245833333333334,260,0
5,"We found Maria to be a great host. She was very responsive before our stay and met us outside the apartment when we arrived. She also arranged a travel cot in the apartment for our baby at no cost which saved us having to bring one from home. Maria's apartment is spacious, clean, quiet and very centrally located - it was perfect for getting everywhere we wanted to go in the city. The main bed was very comfortable with good pillows - so important! overall the apartment was very comfortable and I'd recommend for anyone with a baby/kids. Only things to know are perhaps that the second bedroom is a bit tight on space for a cot so baby needs to be in the main bedroom with you, and also the balcony is accessed from the bedroom not the living room. Not great views but mainly good for smokers as Maria clearly states. The building has a lift but it is very small, so only good for small buggies/prams if you have children! We'd recommend Maria's apartment wholeheartedly, thanks Maria for being a great host.",0.23938186813186813,1011,0
5,The apartment was clean and very spacious. It was located close to everything we wanted to see. Maria was also very helpful and always replied back to our messages right away. If I come back to Barcelona I would stay here again. Would recommend Maria's place to everyone.,0.17539682539682536,271,0
5,"Maria is a great host, so friendly and helpful. The apartment is perfectly situated in the heart of Barcelona. It is very spacious, clean and modern. Highly recommend!",0.4986111111111111,180,0
5,Cool apartment right in the heart of the city. Close to everything you'd need for a stay in Barcelona. Would certainly go back.,0.2119047619047619,127,0
5,This is a well appointed apartment and beautifully located in the city. Very easy to walk the old parts from there.,0.5044444444444445,115,0
5,"Arriving and getting the keys was super easy. The location in Gracia was perfect, especially if Sagrada Familia is in your bucket list. Our kids loved the sleeping behind the curtains. It was great for our family of 4",0.40952380952380957,217,0
4,good,0.7,4,0
2,It is one stylish apartment.,0.5,28,1
2,Apartment on the 2nd floor in a very beautiful building with elevator very well located in Barcelona. Common entrance hall with the Ana apartment. Architect apparent with a rustic side like Spanish inn with a very large table. A single room. Arrivée and flower departure with Ana. All went well!,0.1424107142857143,295,1
5,Ana is an awesome host! The place is located in a wonderfully central spot. We loved all the architectural touches in the apartment too! Ana was very accommodating too. We would stay there again if we’re in Barcelona!,0.53125,217,0
4,Great flat near the Sagrada familia,0.2916666666666667,35,0
3,"Everything was very good. Nice apartment faithful to the description, top reception!",0.7116666666666666,84,0
5,"My boyfriend and I had a fantastic stay at Isidre's place. Once we arrived we were greeted by Isidre's lovely parents, who made us feel incredibly welcome and showed us where everything was. They even recommended a lovely local place for lunch! The apartment is a great size, bigger than we expected, and stocked with everything we needed like toilet paper, milk, cereal and chocolates. It was so lovely! The master bed is so comfy, we slept so peacefully every night. The neighbourhood was great and lively but peaceful too. It's about a 40 minute walk to the beach, or you can take the train in 20 minutes. I would definitely stay here again, and I would recommend this place to anyone going to Barcelona!!",0.3073593073593074,731,0
2,"What a superb stay spent at Isidre! is a helpful host, very caring for his guests. He starts everything to feel at home, at home. his apartment is simply splendid: good location, spacious (3 real bedrooms!), Bright and completely equipped. Spices, oil, sugar, coffee ... In the cabinets: everything is done to simplify our life! At the end of my stay, I had the opportunity to get to know the parents of Isidre: they are charming, very affectionate people and ready to help you. I will not fail to return home during my next stay in Barcelona. !",0.38717948717948725,587,1
5,"Amazing apartment. We received most worm welcome from the host. Walkable to attractions, markets, subway stations.",0.6333333333333334,122,0
2,The positive points were the location and service I received. The property itself left a lot to be desired. I didn't think the announcement photos were compatible with the condition.,0.11363636363636363,182,1
5,"Perfect, clean and nicely done up apartment for family holiday in the university-quarter with a friendly host, who gives you straight tips - thank you Pau for this wonderful place",0.5902777777777778,179,0
5,"What a great host, Rosa. Thank you for everything. It was such a lovely place",0.43333333333333335,77,0
3,"We lived with Rosa for three nights. Lovely and spatial apartment, good area, and named to find around both walking and public transport. The only thing that bothered us was a little smell from the sewer. pink is very sympathetic and helpful.",0.22321428571428573,260,0
4,An ideal place to visit Barcelona with the metro right next to the apartment and located on line 4 very practical to go to many interesting sites in Barcelona. The welcome was very warm and the hosts quickly answer questions. I highly recommend!,0.4499047619047619,253,0
5,We had such a beautiful time here! It is at walking distance from the Poblenou rambla and the beach. It is also next to a great Sicilian ice cream shop called Cosí Duci and a great wonderful restaurant called Minyam. The subway and the metro station is right across the street from this apartment. It is well equipped and has everything needed to enjoy a great stay! We will come back for sure!! Ani is a great host!,0.5889136904761905,416,0
1,"Ani received us great, he was very friendly and I wait for us without problem because our train delayed. The department is very well located near the beach and halfway from the subway station, there are restaurants and supermarkets. Everything went well, you should only consider what the bathroom has reduced space and the room with bunk beds is a bit hot at this time of year. In general, all good and we thank Ani for his treatment and kindness. Thank you!",0.3453125,459,1
5,"A very good address. We settled (two retired couples) at Lara from April 14 to 18. The prior discussions by email with her were fruitful and allowed us to prepare our stay in good conditions. In addition Lara was attentive to facilitate our arrival and our departure. (Reservation of a taxi for the Airport -Appart, Check-in and Check-out route better suited to our schedules) We were very well received by Myriam, Lara's sister-in-law. The apartment, located in a nice neighborhood is very pleasant and well equipped. It may be more suitable for a couple with two children, the second bedroom (2 beds) being smaller. The four floors to rise can be a drawback, but have not really embarrassed us. The bus stop and the nearby metro station are appreciable assets. It is indeed easy to go to all interesting places in the city, and you can also go on foot to Casa Mila and Casa Battlo, as well as to the Sagrada Familia !! So we had a great stay in Barcelona, ​​discovering, among others, Gaudi monuments! Thank you again to Lara for her excellent welcome. See next time ... !!? Patrick,",0.48567982456140363,1134,0
2,"Nice location, short distances to the hotspots. Nicely furnished apartment - with everything you need.",0.39999999999999997,108,1
3,"Adorable apartment with good qualities and equipped to the minimum detail, the unbeatable area and the owner in addition to very pleasant facilitates all kinds of comfort ... we feel at home! More cannot be asked",0.675,212,0
2,You can expect nothing but 5 stars.,0.0,35,1
4,Amazing rental. Phenomenal location - central to everything. Highly recommend.,0.315,80,0
5,"Great location, loved the vibe of the neighborrhood.",0.75,52,0
5,"Unfortunately I did not get to meet Olivia but she was great at keeping in touch with me and making sure everything was clear and we were happy. The apartment was exactly as described, well equipped and in a great location. I would stay again. Thank you",0.39285714285714285,254,0
5,"The apartment looks exactly like all the pictures - and that's a great thing. The place was beautiful. I loved the high ceilings, the small balcony and all the little details (like the map hanging on the wall and all the different tiles throughout the space). Cyril and Olivia had great communication the entire time. When we first arrived I called to have them open the door and they answered right away and let us in. When we wanted more towels we messaged them and they responded quickly and brought more towels over. Overall we loved the apartment and had a great experience. We would definitely stay here again and if you're considering this place I recommend booking it.",0.3245773809523809,676,0
2,"Very large old apartment with a stylish furnishings, optimal location. A dream!",0.3345238095238095,79,1
5,We were only 2 but plenty of room for 4 except bathroom is off one bedroom. Clean and everything there in the kitchen. One downside is that it is noisy in the living area. Old windows and they wouldn’t close properly. But bedroom is quiet. Good bathroom and shower. Water could be a little warmer (it isn’t cold). Excellent location. Near metro and buses to airport. Lots of good restaurants. Do try the Persian 10 minutes away. Felt safe,0.22326388888888885,438,0
5,Cozy room with a great view. Really close to the plaza that the bus drops you off after the airport. Alex was very welcoming and a super nice host.,0.3222222222222222,147,0
2,Alex is very friendly and helpful. The accommodation is easy to access.,0.4604166666666667,77,1
0,Tomasz sent the directions with various transport options immediately after contacting them. He was a very nice homeowner. The bed linen were freshly washed. It was also pleasant to sleep. Communication worked quickly at any time. Next time I would prefer him again. He is highly recommended. Everything great !! Gladly again!!,0.454212962962963,327,1
5,Great place to stay in Barcelona! There is everythings you need ! Thanks again,0.6,80,0
2,Very warm welcome from Martí. The situation in the apartment is ideal and the description does not lie. delighted to have had a good time (2 weeks) in Barcelona.,0.776,173,1
2,Hoist always available. Clean and functional apartment. Excellent location,0.5888888888888889,74,1
2,"Very good stay, central department and with all services; A step away. Marc gave us very good recommendations !!! Thank you so much.",0.5275,132,1
5,"Amazing house with very convenient location,walking distance to Mercat de la Boqueria,thousand restaurants option around. Thanks Marc so much for helping us with the luggage! Pls do not bring bigggg luggage like me, there's no lift. And the room is big and cozy, i love the small balcony the most : )",0.23333333333333334,304,0
2,"Excellent location, 100% super attentive host communication",0.5777777777777778,59,1
2,"Excellent location, close to everything, the place is very wide, fair price",0.5233333333333333,75,1
2,"Quiet apartment, well equipped, clean and very well located 2 steps from the Plaza Catalunya. Easily accessible from the airport, ideal for visiting Barcelona on foot. David is very responsive and allowed us to enter the apartment earlier than expected. Housing at 100 % recommendable!",0.23958333333333337,285,1
2,"The department, well located and in excellent condition. The only negative thing is that we did not have detergent or waste bags which helps to keep the place clean",0.17333333333333334,164,1
4,Thanks damien!,0.25,14,0
3,"The department is well located near Metro stations, it is perfect if you are only going to rest. Mireia allowed us to leave the luggage before check in in to be able to get to know the city.",0.4,190,0
4,"A big thank you to Julie who knew how to welcome us to this magnificent city. The apartment is ideal for a family with two children. Yes, the bathroom is very small and the toilet inside but 3 bedrooms and a living room, it's still luxury! It is located in a very nice, lively but not too nice neighborhood, on the fourth floor which is nice. We go very quickly on the sites to visit. It was 4 wonderful days. THANKS !",0.43807359307359306,418,0
3,We have been very good on the floor. It has everything necessary. The floor is small but it was very clean and tidy. It has three bedrooms (two of them double) and this is a plus. Well equipped kitchen. It has undoubtedly been a good choice because the location has been unbeatable for the purpose of our trip.,0.34809523809523807,310,0
4,Wonderful location Amazing decor. Will be back for another stay,0.5,72,0
2,Spacious apartment and impeccable cleanliness. The place is really central. One of the most beautiful Nocarz that we have rented. Ideal for 2 people.,0.6,149,1
1,That was very good location,0.9099999999999999,27,1
5,Perfect location! Close enough to the main attractions but away from the hustle bustle. The apartment was beautiful and plenty of room for our family of 4. We enjoyed our coffee on the balcony every morning. I will be booking again on our next trip to Barcelona! Natalia is a wonderful host! The cafe next door is amazing and we had the best burgers in Barcelona at the Snack Bar two doors down.,0.451010101010101,396,0
5,Natalia’s place had everything we needed. The terrace was beautiful and surprisingly quiet considering the lively neighbourhood. Great restaurants and bars around. Natalia greeted us on arrival and explained everything very well which was a nice touch.,0.4310606060606061,252,0
4,"First of all, we would like to thank Bryan for his welcome and his patience (had a slight delay following an incident on arrival) The apartment is faithful to the photos ... clean, well located and functional. We had a great stay !!! Thank you Maria :-)",0.39285714285714285,278,0
5,Was an excellent stay. Place was great looked just like the pictures… was close and walkable to other attractions. Overall great stay,0.495,133,0
4,"Clean, sober, well equipped accommodation. We felt at ease at 5 adults. Complies with the photos. Metro stations nearby, close shops and appreciable bakery. The host is very responsive and easy to communicate but we have not met them because the apartment is managed by a company, but it is easy to reach and offer some recommendations to the apartment. Thank you for the very good service, we have spent a fantastic stay :)",0.36037037037037034,442,0
2,Smooth interaction The apartment is comfortable Near the ocean A lovely area around the ocean A lovely graphics,0.4666666666666666,123,1
2,Exceptional apartment. Good location and benefits. We feel at home totally! We will repeat insurance.,0.45555555555555555,113,1
5,"A beautiful apartment close to everywhere, and she is an amazing host. I highly recommend!",0.55,90,0
5,"Don't think, book it. Laia's place is awesome, and we really enjoyed our stay. The location is great, close to everything but away from the hustle and bustle. The apartment is new and tastefully designed and decorated. Has everything that one can need, including the best shower we ever had at an nocarz (and better than most hotels) and an awesome terrace. Moreover, Laia kindly provided baby gear so we didn't have to schlep around too much stuff. They even replaced our towels with clean ones half way through the stay, which is a great touch. The only thing to note is that there are 20-25 stairs to get to the elevator, which we didn't expect and sucked a bit with a stoller, so if you have kids or accessibility limitations you should know, but hey it's Barcelona and we need to be thankful for the existence of an elevator... Wasn't too big of a deal honestly. Bottom line, awesome stay at one of the best nocarzs we have stayed it. You won't regret booking it.",0.5464646464646463,978,0
5,"We loved the balconies and the vistas! La Sagrada Familia and some of the mountains are in clear view from the apartment, which makes Laila’s home so magical. It’s centrally located and we never felt like the apartment was too far out of the way from the neighborhoods we ventured out to visit. I would definitely book with Laia again!",0.2625,335,0
5,"Laia was great. Provided a list of things nearby that helped eased our travel, she was communicative, and provided solutions to any and all problems. Space was amazing, location was ideal, and will stay there next time! Best host I’ve had in years.",0.5750000000000001,258,0
5,"Great apartment in great location close to everything. We really enjoyed our stay in Barcelona. Isabelle was an amazing host, who gave us lots of insider tips and made us feel at home instantly! Totally recommend :)",0.5333333333333333,215,0
3,"Nice and quiet place, very central located in a busy but not over-crowded street.",0.175,81,0
2,"The landlord is very good and has a good communication. The location is also great, and it is quick to walk to Batello House and not far from the shopping street. The only disadvantage is that you cannot take a bath with four people, and at most you will have no hot water. But overall it's pretty good",0.3653030303030303,302,1
2,"We were in Barcelona with 3 more friends for 5 days and we could not have chosen a better place .... the Gemma department is very well located, just 2 blocks from the Rambla and 3 from Paseo de Gracia .... next to the square of the University and Plaza Cataluña ... really strategically located to be able to walk everywhere .... You have everything you need to have a comfortable and pleasant stay ... I recommend it 100%",0.37916666666666665,422,1
5,"Patricia was a nice host. She was very flexible with our timing since we had some difficulties with our flight. The appartement is exactly as described, a good clean room and a private bathroom. The location is ideal to visit Barcelona when using metro services. Although the flat is shared with Patricia and her husband, it didn't feel like that. We had a great time in their city thanks to their hospitality.",0.3991666666666667,410,0
5,"The house is small, but very comfortable and is in a great location. It is 10 minutes on foot from Parc Guell and the Sagrada Familia. Also the metro is very close with 3 stops you arrive on the Rambla. It takes about 30 minutes on foot. We found some ""problems"" but they did not negatively affect our stay, and they are: - the broken shutter - the pans still greasy - they only gave us 2 towels and they were small, luckily we had our own. In addition to this the house has all the necessary services for a comfortable stay and to be able to enjoy a holiday. The host is always available for any eventuality and responds very quickly.",0.21577777777777776,655,0
5,"Watch out if you are scheduled to arrive after 9pm as there is a $30 fee. We were unaware of this when we booked in 2021 and in none of the emails / confirmation messages was this highlighted. The location is a little far out of city centre so if you want to be able to walk / not relay on public transport this maybe isn’t the best place for you. In terms of cleanliness, the apartment was clean, however could do with a little bit of love. The shower did leak, the “outdoor terrace” area is heavily shaded, and the television signal did not work.",0.18916666666666668,559,0
2,"Comfortable location, very nice area. Very attentive host. The sofa bed is a bit uncomfortable. Well equipped kitchen.",0.30000000000000004,118,1
4,Everything was super! Good location! Very ok apartment with big terrace!,0.4854166666666666,72,0
4,"Very welcome. Excellent location (close to restaurants, holes, Sagrada Familia and a taxi station). Animated district without being noisy. Fully equipped apartment (nothing is missing). Only drawback: the steps to climb to the third floor (which can be trying, especially with a stroller). We had a great stay.",0.37142857142857144,322,0
2,"Good location, 1 min from the sacred family and near the metro. Very accessible host and apartment with good condition",0.496875,118,1
2,Everything corresponds to the price. Everything is fine.,0.4166666666666667,56,1
4,"Very pleasant accommodation, very clean and tastefully redone even if lacking a bit of brightness and a slightly more clear view. Practical in terms of access to transport, and at the feet of the Sagrada Familia but in a very quiet small street.",0.2966666666666667,245,0
5,Thank you for this amazing stay! The location is magnificent. The apartment was very clean and haf everything available thats needed for a comfortable stay in Barcelona.,0.6053333333333333,169,0
5,"PROs: The location of Felix’ place is excellent — one block from the Sagrada Familia and close to tons of restaurants. Felix was super responsive and helpful — he does have to hand you the key, which we felt bad about because we arrived very late at night but he didn’t seem to mind. The apartment is comfortable for a family and there is a washer for laundry. There was a coffee maker and cream. Apt was well stocked with shampoo, body wash, cleaning supplies, etc. CONS: We did get charged extra for arriving late plus the tourism tax — listing does not appear to have been updated with the latest tourism tax bc it changes so I would make sure to ask amount plus age of kids that have to pay. While it worked for us, it is a 4th floor walk up and staircase is narrow. I only mention bc it may not work for some with a lot of heavy suitcases.",0.11023809523809525,853,0
5,Juan Carlos and Nina's property was an excellent base from which my group of 7 explored Barcelona. The apartment is very well situated. The place was very neat and clean and well equipped. Juan Carlos and Anna were gracious hosts and I'll stay with them again.,0.19333333333333333,260,0
5,"Jon was a great host - very welcoming and allowed us to check in early which was very helpful. The apartment itself is amazing - clean, small but spacious, had everything we needed, good location. Loved the balcony in the evening for a glass of wine. We would recommend this place to all of our friends and would definitely stay again if we return to Barcelona. Thanks Jon!",0.33333333333333337,373,0
2,"Housing consistent with the photos, the balcony is however very small, otherwise the equipment is of good quality, such as air conditioning, and wifi The owner welcomed us, gave us reliable documents concerning points of interest such as restaurants, The accommodation is well placed, even if it takes 30 minutes to go to the beach, if not for the rest, we are central",0.10416666666666667,381,1
5,"Great place, great host. Suited our needs very well.",0.6,52,0
5,Really nice and authentically Spanish feeling apartment. We really liked the location too as we could easily get anywhere and it wasn't right in the middle of the tourist areas. The apartment itself is a little noisy with the above neighbours stomping around on Friday and Saturday at around 2am. Nothing too bad though. There's a really amazing tapas restaurant nearby called La Platilleria that does amazing wine and better food! The host was absolutely wonderful and really made us feel welcome and gave us the low down on the whole city.,0.2722773368606702,541,0
4,A very good location. Answers to any super fast inquitude. The apartment is comfortable and has enough to have a good time.,0.4238888888888888,123,0
